{
  "$schema": "http://json-schema.org/draft-07/schema#",
  "title": "agent-system project configuration",
  "description": "Drop this at <repo>/.claude/agent-system.json to opt a project into the agent-system. Absence of this file means the project is not opted in: hooks stay silent and the commit guard never fires.",
  "type": "object",
  "required": [
    "project"
  ],
  "additionalProperties": true,
  "properties": {
    "project": {
      "type": "string",
      "description": "Short project name, used as the event-log key and the dashboard title."
    },
    "worktreesDir": {
      "type": "string",
      "description": "Directory holding the fixed worktrees. Each is auto-named `lane<N>` by `lanes new` (N = max existing + 1) — the number is baked into the directory name at creation time, so it stays stable across add/remove; it is never recomputed from position. Supports ~ expansion. This is only the DEFAULT: `lanes worktrees-dir <path>` sets a per-machine override in the gitignored `.claude/agent-system.local.json`, which wins over this field whenever present (useful when teammates want their lanes on different disks). `lanes adopt` writes new values there, never here. Omit this (and basePort) if the repo does not use worktrees: lanes are disabled, `lanes status` falls back to whatever sessions appear in the log, and everything else still works."
    },
    "basePort": {
      "type": "integer",
      "description": "Dev-server port prefix, purely informational — nothing starts a server for you. Lane N is shown as serving on `${basePort}${N}` (basePort 300 -> lane 2 is 3002). This is only the DEFAULT: `lanes base-port <n>` sets a per-machine override in the gitignored `.claude/agent-system.local.json`, same file and same precedence as `worktreesDir`."
    },
    "commands": {
      "type": "object",
      "description": "Project commands. /gate runs the gates once at the end; the reviewer never runs them. A command left null is a gate that is skipped, and /gate says so.",
      "additionalProperties": {
        "type": [
          "string",
          "null"
        ]
      },
      "properties": {
        "install": {
          "type": [
            "string",
            "null"
          ]
        },
        "lint": {
          "type": [
            "string",
            "null"
          ]
        },
        "lintFix": {
          "type": [
            "string",
            "null"
          ]
        },
        "typecheck": {
          "type": [
            "string",
            "null"
          ]
        },
        "test": {
          "type": [
            "string",
            "null"
          ]
        },
        "testTargeted": {
          "type": [
            "string",
            "null"
          ]
        },
        "build": {
          "type": [
            "string",
            "null"
          ]
        }
      }
    },
    "branch": {
      "type": "object",
      "properties": {
        "pattern": {
          "type": "string",
          "description": "Regex whose first all-digits capture group is the issue number. Default: ^[a-z]+/(\\d+)-"
        },
        "prefixes": {
          "type": "object",
          "description": "Branch prefix -> issue label. null means no label.",
          "additionalProperties": {
            "type": [
              "string",
              "null"
            ]
          }
        },
        "base": {
          "type": "string",
          "description": "Base branch new work branches off, and the reference for ahead/behind and free-lane detection. Default \"main\"."
        }
      }
    },
    "review": {
      "type": "object",
      "properties": {
        "commitGuard": {
          "type": "boolean",
          "description": "Default true: blocks `git commit` when the current diff has not been through /gate. It does not just fail — it hands the agent a reason, the agent asks you whether to review first or commit anyway, and 'anyway' arms a one-shot bypass (`lanes allow-commit`). Set false to disable; /gate still works when invoked directly."
        },
        "largeDiffThreshold": {
          "type": "integer",
          "description": "Changed-line count past which the guard warns that review quality degrades. Default 400."
        },
        "excludePattern": {
          "type": "string",
          "description": "Regex of generated/vendored paths to drop from review scope. Reviewing them is pure noise."
        },
        "domainAxes": {
          "type": "array",
          "items": {
            "type": "string"
          },
          "description": "THE field that decides whether the reviewer is worth running. Judgment axes on top of architecture/duplication/documentation currency, which the reviewer already checks for free — leave this empty and you get a reviewer that finds only what your linter already found. Test for an axis: a linter could not check it; if a rule can be mechanised, put it in lint config instead, where it runs in milliseconds. How to find yours: read the last 10-20 real review comments your team left on PRs, discard everything about formatting/naming — what's left, the comments that needed someone who knows this product, is your list. Also check the project's own guides (a CLAUDE.md, an architecture doc, a decisions log) for rules already written down as load-bearing — often a better source than mining PR threads, since someone already did the curating. Write sharp axes in your team's own words, no target count — the quality bar sets the size of the list on its own: each vague or redundant one dilutes the ones that matter, so keep only what passes the linter test above, and add more later as real recurring defects surface, however many that turns out to be. Bad: 'Follow best practices', 'Code should be readable'. Good: 'Money paths: anything touching price, tax or discount must keep the calculation in one place and record the inputs it used. A second copy of the formula is a defect even when it agrees today.'"
        },
        "gates": {
          "type": "array",
          "items": {
            "type": "string"
          },
          "description": "Ordered `commands` keys /gate runs in Phase 5, after the fixes are applied. Default [\"lintFix\", \"typecheck\", \"lint\", \"test\"]. A key with no command, or a null one, is skipped and reported as skipped. Those four carry fixed semantics: `lintFix` autofixes silently, and `typecheck`, `lint` and `test` report failures as warnings rather than blocking. Any other key runs as configured and its failure is reported the same way, so this is where the rest go — `build`, `e2e`, a coverage floor, a schema check. `build` is deliberately not in the default: it is free on some stacks and minutes on others, and only the project knows which. Weigh each addition against CI the same way — a gate that already runs there as a required check costs minutes on every commit to save minutes on every push, and one that needs Docker or rebuilds a local database is a poor fit for a per-commit gate."
        },
        "decisionsFile": {
          "type": [
            "string",
            "null"
          ],
          "description": "Repo-relative path to the decisions log that /gate and /architect propose entries for, and that the reviewer checks the diff against. Default \"DECISIONS.md\" at the repo root; set it when yours lives elsewhere (\"docs/DECISIONS.md\"), or null to opt out. A path naming a file that is not on disk also counts as opting out — neither skill creates the log uninvited."
        }
      }
    },
    "tests": {
      "type": "object",
      "properties": {
        "framework": {
          "type": "string",
          "description": "Test framework name (e.g. \"vitest\", \"pytest\"), shown to the test-writer agent for context."
        },
        "expertiseDoc": {
          "type": [
            "string",
            "null"
          ],
          "description": "Repo-relative path to the project's testing conventions doc, read by the test agent before writing anything. Keep it short — test-writer reads it in full before every test-writing pass; point it at a conventions doc, never at a test file."
        },
        "locationRule": {
          "type": "string",
          "description": "Where new test files belong, in your own words (e.g. \"Co-located as <name>.test.ts next to the unit under test.\")."
        }
      }
    },
    "architect": {
      "type": "object",
      "properties": {
        "issueProvider": {
          "type": "string",
          "enum": [
            "github",
            "none"
          ],
          "description": "\"github\" needs `gh` authenticated (check with `gh auth status`) — /architect creates an issue whose Start section creates the linked branch. \"none\" skips that: /architect hands you the finished spec instead, and you file it wherever you actually track work."
        },
        "specSections": {
          "type": "array",
          "items": {
            "type": "string"
          },
          "description": "Section headings /architect fills in, in order, when writing the spec. /architect also appends a 'Suggested implementation model' line after the last section when architect.suggestImplementationModel is not false; that line is not one of these headings and this array does not control it."
        },
        "challengeSpec": {
          "type": "boolean",
          "description": "Run the spec-challenger agent against the draft spec before creating the issue. Default true."
        },
        "suggestImplementationModel": {
          "type": "boolean",
          "description": "Append a 'Suggested implementation model' (Sonnet or Opus, with one line of reasoning) after the spec's last section, and carry it into the issue body, the confirmation summary and the final handoff. Default true."
        }
      }
    },
    "dev": {
      "type": "object",
      "description": "Per-lane dev services. Every project declares its own: no two stacks start the same way, and one repo can have several services (e.g. a React client and a Python API) with different commands, directories and port series. Started detached as process-group leaders, so `lanes stop` kills the whole tree. Omit this entirely and `lanes dev` just tells you nothing is declared — everything else still works.",
      "properties": {
        "services": {
          "type": "array",
          "items": {
            "type": "object",
            "required": [
              "name",
              "command"
            ],
            "properties": {
              "name": {
                "type": "string",
                "description": "Short id, used in `lanes dev` output, log filenames and `lanes logs <n> <name>`."
              },
              "command": {
                "type": "string",
                "description": "Shell command. Placeholders: {port} {lane} {worktree} {name}."
              },
              "cwd": {
                "type": "string",
                "description": "Directory relative to the worktree root. Default \".\" — set it for monorepo services."
              },
              "portBase": {
                "type": "integer",
                "description": "Port prefix for this service. Lane N gets `${portBase}${N}` (400 -> lane 2 is 4002). Defaults to the top-level basePort. Per-machine overridable by service name via `lanes service-port <name> <n>`, same gitignored local file and same precedence as worktreesDir/basePort."
              },
              "url": {
                "type": "string",
                "description": "Optional URL for this service. Printed by `lanes dev` when it starts, and shown on the `lanes status` dashboard while it is running. Same placeholders."
              }
            },
            "additionalProperties": false
          }
        }
      },
      "additionalProperties": false
    }
  }
}
